{"atlas_bundle_hashes":{"artifacts.json":"6571306fc660bdbeeabe9e51303fab2eeaec5fedb82813c16da45fd322366e89","events.json":"abc7f1f877985481b3d88b96edfb1186ce56964b6e0300a005bc0699f11c3a3f","facts.json":"4df041e25c7e1367905a57441f622f0cda4781b701b94a148413ff8fe4af4f33","provenance.json":"dcc60a6598c6e071926bfd12bb22629d3daf0cce10760e47771dff4f25f0855e"},"atlas_pir_ref":"31d76d094f1206e64a6920da4775d0a684618357","atlas_repository":"https://github.com/Sovrance/Atlas","benchmark_id":"EZ-B001","certificates_file_hash":"6303a3890721f39eb2b72ba6fb925dd4c5ba12a43662a4d4bddfe895ddcd250c","elementzero_commit":"9b13369ee7a5842b10da1864f83b08bd48228a32","feature_policy_id":"ez-b001-identity-zn-v1","freeze_id":"frz_3d3a4532f61e0906","ground_truth_policy":"ez-gt-policy-v1:evaluated_non_estimated_only","knowledge_freeze_fact_id":"fct_sha256_162698dfd84f706c","legacy_id":"ZME-B001","library_versions":{"elementzero":"0.2.0","numpy":"2.4.4","pir":"0.1.0","scipy":"1.18.0","sklearn":"1.9.0"},"model_fit_fact_id":"fct_sha256_f528f6147672ff4b","model_id":"EZ-SEMF-GP-RESIDUAL-v1","model_manifest_hash":"9f0cedbd24c67a0db8b7b20796431c3749b04a78bc9442fbe70af5337c7daba7","normalizer_version":"ez-norm-v2","observable":"mi:nuclear_atomic_mass_excess","parser_version":"ame-parser-v2","prediction_fact_ids":["fct_sha256_c1407458ae4cede5","fct_sha256_350e62913dc8850b","fct_sha256_e52baea6dc4d43a2","fct_sha256_057ee74a8b8f0274","fct_sha256_fc95aedf8ee53a79","fct_sha256_df7bcd6d149539cc","fct_sha256_c808056b18f84fcc","fct_sha256_cb36af2944cd7843","fct_sha256_0afccd2cfce267da","fct_sha256_42db29a652e38263","fct_sha256_b7f7aa33ac99d104","fct_sha256_1b1288ddc63b5f7c","fct_sha256_5b89dfdec71aaddf","fct_sha256_a5c55b99453f9029","fct_sha256_1dbbec262c196e91","fct_sha256_374136536615cbaa","fct_sha256_37a51fc6e9c22e57","fct_sha256_09abba360bc19e4c","fct_sha256_642c8eee62e12df3","fct_sha256_483ad07477ce0dfa","fct_sha256_0643d111f2c4018e","fct_sha256_64dc9fbda88573ff","fct_sha256_c5a39234cde2ab2f","fct_sha256_adb844e2da37d975","fct_sha256_88b99530f90ba3e5","fct_sha256_655f72d7acaa8b97","fct_sha256_fe786f8e16ef2ae3","fct_sha256_cf0191e397613212","fct_sha256_0c4a5cb6c46cfd2f","fct_sha256_1b05bee7fc8cbeab","fct_sha256_6093ec54ba172c50","fct_sha256_5cac5b612df7bf59","fct_sha256_ab13b792ca6ef58b","fct_sha256_adf7ca53862e7423","fct_sha256_b6b207131f80f55e","fct_sha256_2ee0cefa3f987818","fct_sha256_a1b9fa300efbe0cb","fct_sha256_a3f9b700d7459e1b","fct_sha256_4ce4ddc5e856d159","fct_sha256_a0810be33939360a","fct_sha256_12a4204fe2485ad2","fct_sha256_4743380ba739c0f3","fct_sha256_8e5ebfb54609d7ab","fct_sha256_3d50dda6285fdadf","fct_sha256_9fbdc0362994980e","fct_sha256_9004494e45f8773b","fct_sha256_b120ec5ea6d14dac","fct_sha256_eb70d1756d366b6b","fct_sha256_3597ad88dbac53da","fct_sha256_5a2773fe2b206525","fct_sha256_47df0645bf87038b","fct_sha256_47513bcd9b7c8944","fct_sha256_863788a26b79ee0c","fct_sha256_6960205fdb501a58","fct_sha256_c7d1043709021be7","fct_sha256_aa663aee11159c45","fct_sha256_5740c95da0af9ac7","fct_sha256_c6211f8c8ab46135","fct_sha256_f4996ce5c55c54c2","fct_sha256_d4d3906435f3cf0b","fct_sha256_d2262f20e9fc3619","fct_sha256_94bef84974d679c9","fct_sha256_e6ea3d3c04458d7b","fct_sha256_38723d021ce3c9ca","fct_sha256_da6c4973c91ce2e0","fct_sha256_8f422dea1f31358d","fct_sha256_58993c10a6417878","fct_sha256_08d6271d7970f3c4","fct_sha256_05c4a6e760343460","fct_sha256_7604c418e34f440f","fct_sha256_290e6af4744b3686","fct_sha256_60a9df9ce3e50473","fct_sha256_cec7060b2c1b2f8e","fct_sha256_b651dff5a6bc2bda"],"prediction_set_fact_id":"fct_sha256_82a45d6bb8e28403","predictions_file_hash":"09c17bbde8f6b8130b5c1920bdfd624bae2414dd97e93c7fe91a8258268ffb8e","predictive_distribution":"gaussian","protocol_version":"0.3.0","random_seeds":{"model":0},"run_id":"EZ-SEMF-GP-RESIDUAL-v1","source_hashes":["2167f57a2a98331e4649b2dd2b658a9006ed4fba1975729ebfe52a42b4b9218a"],"stage":"predict","target_identity_digest":"9d3e7d5f412d477152e37c15d247dd6f6c35c108c1f1e77e700f87ad4d02d576","target_ids":["Z8-N3","Z5-N15","Z5-N16","Z17-N13","Z24-N20","Z25-N21","Z26-N22","Z27-N23","Z28-N24","Z20-N35","Z20-N36","Z21-N37","Z22-N36","Z21-N38","Z22-N38","Z23-N39","Z23-N40","Z27-N43","Z37-N36","Z29-N48","Z29-N50","Z31-N53","Z31-N54","Z44-N45","Z46-N46","Z46-N47","Z48-N49","Z37-N64","Z49-N52","Z37-N65","Z52-N52","Z54-N54","Z53-N61","Z48-N84","Z56-N94","Z59-N97","Z59-N98","Z60-N98","Z60-N99","Z60-N100","Z61-N99","Z61-N100","Z62-N100","Z62-N101","Z62-N102","Z63-N101","Z64-N100","Z63-N102","Z64-N101","Z65-N100","Z64-N102","Z64-N103","Z65-N102","Z65-N103","Z91-N120","Z91-N129","Z93-N127","Z91-N131","Z93-N129","Z93-N130","Z93-N131","Z93-N133","Z99-N147","Z97-N151","Z101-N148","Z101-N149","Z101-N151","Z103-N150","Z103-N151","Z105-N152","Z105-N153","Z107-N154","Z107-N155","Z109-N157"],"training_dataset_fact_id":"fct_sha256_4b78e0b030d06be0","uncertainty_method":"GaussianProcessRegressor return_std"}
