{"atlas_bundle_hashes":{"artifacts.json":"6571306fc660bdbeeabe9e51303fab2eeaec5fedb82813c16da45fd322366e89","events.json":"abc7f1f877985481b3d88b96edfb1186ce56964b6e0300a005bc0699f11c3a3f","facts.json":"f7bc31755e23a8e31faedaa33a96782272873ebebd194afbd00a69ce43f66683","provenance.json":"992547e36e57c75e65d4c55a9839e317567961364db9155cb9b5d257f16b4b83"},"atlas_pir_ref":"31d76d094f1206e64a6920da4775d0a684618357","atlas_repository":"https://github.com/Sovrance/Atlas","benchmark_id":"EZ-B001","certificates_file_hash":"f2de4ea1aa5aeea99f381a4985973f3b30ffa0b9cd3942edb374594fac9a9376","elementzero_commit":"9b13369ee7a5842b10da1864f83b08bd48228a32","feature_policy_id":"ez-b001-identity-zn-v1","freeze_id":"frz_3d3a4532f61e0906","ground_truth_policy":"ez-gt-policy-v1:evaluated_non_estimated_only","knowledge_freeze_fact_id":"fct_sha256_162698dfd84f706c","legacy_id":"ZME-B001","library_versions":{"elementzero":"0.2.0","numpy":"2.4.4","pir":"0.1.0","scipy":"1.18.0","sklearn":"1.9.0"},"model_fit_fact_id":"fct_sha256_b14056d45a0a1d19","model_id":"EZ-SEMF-LS-v1","model_manifest_hash":"677f9a5789471725878813fe893ab8f2cff7a1caefe010f72fb7e24eb5d0e3af","normalizer_version":"ez-norm-v2","observable":"mi:nuclear_atomic_mass_excess","parser_version":"ame-parser-v2","prediction_fact_ids":["fct_sha256_c05bd2cf6c1d98a2","fct_sha256_fd5b231d6f232d1d","fct_sha256_08ec6626ce827d1a","fct_sha256_c1cd5ecc7dd9386c","fct_sha256_50a90941bcda1b3e","fct_sha256_4c6b73c4cbd3fb65","fct_sha256_876ef053fab03510","fct_sha256_dba99aff69c89806","fct_sha256_b56cebb99c6b2f74","fct_sha256_5724adceef785b88","fct_sha256_dc8ea6e38b4ed239","fct_sha256_4375ed8ac70df3bd","fct_sha256_2e3f7588c372cc8d","fct_sha256_7f12cdac11fa00a1","fct_sha256_33af40408659d7ff","fct_sha256_c0bd0193b1a4a20a","fct_sha256_b5ebd1dd02a1a612","fct_sha256_6557d219fd7c8c75","fct_sha256_0cdba363f7832797","fct_sha256_76d477b1e54b1576","fct_sha256_879f54489abb837f","fct_sha256_1d5c4f2c69addd0f","fct_sha256_f12184910de5e768","fct_sha256_a9bad1850b3250b6","fct_sha256_bae86bdde6f2defe","fct_sha256_00df71ecfa394147","fct_sha256_2431f30468a5b717","fct_sha256_c04d1435eef7e589","fct_sha256_78bcc3480f798377","fct_sha256_54be1dc4ce8f4950","fct_sha256_67d0771a9974c803","fct_sha256_6969683bbe0cb477","fct_sha256_b71940f0fc3d6915","fct_sha256_00dc902082bda9eb","fct_sha256_8479d04af8c7ae71","fct_sha256_52464320afe4b99e","fct_sha256_eb04b2182bcd46de","fct_sha256_7bb023f3ad556bda","fct_sha256_c1cc3a31cc76bec8","fct_sha256_1505fe22fa904a86","fct_sha256_755287c8f040efd6","fct_sha256_3d2ddcf47022c341","fct_sha256_cb802dbbd3667df0","fct_sha256_8387172bb1252e7b","fct_sha256_0278fbf525a4abf1","fct_sha256_acbaf8e985639e6d","fct_sha256_13d7f2aa0f481474","fct_sha256_6595a92d1151584e","fct_sha256_e812a8a2502360fd","fct_sha256_7faea70fc27e5015","fct_sha256_f9d96139609c2277","fct_sha256_540edb168ba18aa2","fct_sha256_2454cfb475d9aa97","fct_sha256_e0ba817d9dac6155","fct_sha256_e4cc53341ab8f77c","fct_sha256_3b5fd462596a7569","fct_sha256_45993da3017ea84b","fct_sha256_228ed13d9911dce3","fct_sha256_65434f05fa8ec07c","fct_sha256_8737380b9723b0cc","fct_sha256_83b23cc1a3dfb59b","fct_sha256_1751009ff8f20e92","fct_sha256_3c21809ba6e2b633","fct_sha256_693ff83f0cdad472","fct_sha256_c282eedb21629ad1","fct_sha256_7b1b924c50fb88f9","fct_sha256_4b613d7f390d4f18","fct_sha256_4d55fd5a9b59d01c","fct_sha256_8c8570aaa18e556e","fct_sha256_863a57c1e9d0cd03","fct_sha256_4331069427449854","fct_sha256_a0e79c8d3a048637","fct_sha256_1a3a04db661f077b","fct_sha256_929757fcf9210cd2"],"prediction_set_fact_id":"fct_sha256_437d30a4616afe33","predictions_file_hash":"541835b59305f46fe80a31840a5a7317b313b180e9725f49af1e2f9ab6948335","predictive_distribution":"gaussian","protocol_version":"0.3.0","random_seeds":{"model":0},"run_id":"EZ-SEMF-LS-v1","source_hashes":["2167f57a2a98331e4649b2dd2b658a9006ed4fba1975729ebfe52a42b4b9218a"],"stage":"predict","target_identity_digest":"9d3e7d5f412d477152e37c15d247dd6f6c35c108c1f1e77e700f87ad4d02d576","target_ids":["Z8-N3","Z5-N15","Z5-N16","Z17-N13","Z24-N20","Z25-N21","Z26-N22","Z27-N23","Z28-N24","Z20-N35","Z20-N36","Z21-N37","Z22-N36","Z21-N38","Z22-N38","Z23-N39","Z23-N40","Z27-N43","Z37-N36","Z29-N48","Z29-N50","Z31-N53","Z31-N54","Z44-N45","Z46-N46","Z46-N47","Z48-N49","Z37-N64","Z49-N52","Z37-N65","Z52-N52","Z54-N54","Z53-N61","Z48-N84","Z56-N94","Z59-N97","Z59-N98","Z60-N98","Z60-N99","Z60-N100","Z61-N99","Z61-N100","Z62-N100","Z62-N101","Z62-N102","Z63-N101","Z64-N100","Z63-N102","Z64-N101","Z65-N100","Z64-N102","Z64-N103","Z65-N102","Z65-N103","Z91-N120","Z91-N129","Z93-N127","Z91-N131","Z93-N129","Z93-N130","Z93-N131","Z93-N133","Z99-N147","Z97-N151","Z101-N148","Z101-N149","Z101-N151","Z103-N150","Z103-N151","Z105-N152","Z105-N153","Z107-N154","Z107-N155","Z109-N157"],"training_dataset_fact_id":"fct_sha256_4b78e0b030d06be0","uncertainty_method":"global training residual standard deviation"}
