{"atlas_bundle_hashes":{"artifacts.json":"691f7db2ffe8a881538b3025e71b1dc52b503699ba3628de8b703c18fdc932a5","events.json":"7c5ab706c2e26885d57269049fd45654c4154eea5376c50083cd7a053a3c4acb","facts.json":"7e13f2e30c22b6e0013a4cbb7c780ea2a6a80541edf221792f91219c0519a5ed","provenance.json":"55514e1e7f260fe0a06013b625ce5c38dc02808af0f32f76b5e8e219f3375af9"},"atlas_pir_ref":"31d76d094f1206e64a6920da4775d0a684618357","atlas_repository":"https://github.com/Sovrance/Atlas","benchmark_id":"EZ-B001","certificates_file_hash":"617bd808305b6af6bb6ace36986a5e1eb8292ea4eaa50afc35d6fe5c5e5ad105","elementzero_commit":"718cbe1f840048952752b87ccc2550467f9d5b78","feature_policy_id":"ez-b001-identity-zn-v1","freeze_id":"frz_0883fe445515efe7","ground_truth_policy":"ez-gt-policy-v1:evaluated_non_estimated_only","knowledge_freeze_fact_id":"fct_sha256_e3e2ee724496585b","legacy_id":"ZME-B001","library_versions":{"elementzero":"0.2.0","numpy":"2.4.4","pir":"0.1.0","scipy":"1.18.0","sklearn":"1.9.0"},"model_fit_fact_id":"fct_sha256_921c218cd714f7e8","model_id":"EZ-SEMF-GP-RESIDUAL-v1","model_manifest_hash":"495a678b44eaae2f4c0b5d920a5cd28b229a777a631f6d503bc410ff1c9e6818","normalizer_version":"ez-norm-v2","observable":"mi:nuclear_atomic_mass_excess","parser_version":"ame-parser-v2","prediction_fact_ids":["fct_sha256_156058e5f10d1eb0","fct_sha256_5ce4563511e4a726","fct_sha256_3840c9e0a38adb19","fct_sha256_85024648dd1a6b17","fct_sha256_7f17d95e80d718f4","fct_sha256_39b1bfde12f7950d","fct_sha256_2f92ae71a795590a","fct_sha256_a36d2fa478f983c2","fct_sha256_129df94a4f84d426","fct_sha256_1c86232eeefef882","fct_sha256_e3632d9a236e3fa1","fct_sha256_9dc5ea02d4aacedf","fct_sha256_13283e218f337888","fct_sha256_8754ca8deb20f841","fct_sha256_8310441d0ab980e2","fct_sha256_9565a99166b97cf4","fct_sha256_d2296ce343ad4c35","fct_sha256_98fced7c22ab3173","fct_sha256_7e97e9d236a245e7","fct_sha256_29d4bec9f8d8b6c1","fct_sha256_193820993c39c61e","fct_sha256_2b876e69ce758b7d","fct_sha256_ec7680812c88a0a1","fct_sha256_bf89f5dd1212e80f","fct_sha256_17b50be8fb484971","fct_sha256_2741500f48d1426c","fct_sha256_fd9ef6dfd6010e06","fct_sha256_8f01e4b5cb6639c2","fct_sha256_6414388f2f24b347","fct_sha256_000fe82883c0cd51","fct_sha256_237b44ea7c83ff66","fct_sha256_573a7f3c00caafed","fct_sha256_645f0c885625b27d","fct_sha256_515fa760d8a8e858","fct_sha256_03c5bce17ce09919","fct_sha256_79831a95e1dc0bf6","fct_sha256_f4514e3afeef941a","fct_sha256_656d93594157313f","fct_sha256_99ae65d4b5163bbc","fct_sha256_628caa715e3c7db6","fct_sha256_23ca13ad2b88b521","fct_sha256_74b606cb9dd3666f","fct_sha256_a41a49141e9ae390","fct_sha256_8ecd35db0c403753","fct_sha256_95b8ae22e01d8f49","fct_sha256_9d9288065104b040","fct_sha256_2fe5d83bfdd83a47","fct_sha256_6d2e5bb60a0f7a96","fct_sha256_2825f46fc4b55650","fct_sha256_1d6946ff5f244623","fct_sha256_fca218fb3c27ee2e","fct_sha256_6e070a436978d876","fct_sha256_2fca862c11ce8c74","fct_sha256_ac3cc282c91cc674","fct_sha256_c334b3c8c3f379ad","fct_sha256_cc9a4f00e7012c39","fct_sha256_5cdfaec0598782ef","fct_sha256_0ec6f7beb43b06d7","fct_sha256_c7989446e039d3c2","fct_sha256_4af2fa39e28c2359","fct_sha256_03beeed1b0d4259f","fct_sha256_0da3cd748fc9fd59","fct_sha256_4b212cf8437b1d1f"],"prediction_set_fact_id":"fct_sha256_dc9687805c36793f","predictions_file_hash":"1198bae0144ed35dc1582759098c85cd8095cf1614e5f1b7d3757fb56e7b96b8","predictive_distribution":"gaussian","protocol_version":"0.3.0","random_seeds":{"model":0},"run_id":"EZ-SEMF-GP-RESIDUAL-v1","source_hashes":["81e887c71c2c54c76caea36fd861b195a7f3eeb77d04b520e05fa97e0eedd7f3"],"stage":"predict","target_identity_digest":"d8c1aa9314c0256ecdbece276f7a154ea4f73c5dd9245288768e3afd12a3a9ec","target_ids":["Z4-N11","Z10-N5","Z11-N6","Z5-N14","Z7-N16","Z9-N20","Z17-N12","Z18-N12","Z11-N22","Z11-N23","Z12-N25","Z18-N30","Z19-N33","Z27-N25","Z19-N34","Z20-N33","Z20-N34","Z21-N35","Z29-N27","Z21-N36","Z25-N37","Z24-N40","Z30-N52","Z40-N42","Z41-N43","Z32-N54","Z34-N57","Z37-N63","Z39-N66","Z40-N66","Z40-N67","Z41-N69","Z43-N71","Z43-N72","Z45-N76","Z46-N77","Z48-N81","Z48-N83","Z63-N74","Z51-N87","Z53-N88","Z56-N93","Z57-N93","Z57-N94","Z81-N109","Z83-N111","Z87-N110","Z85-N113","Z87-N111","Z88-N113","Z87-N115","Z89-N116","Z89-N117","Z82-N133","Z92-N123","Z92-N124","Z93-N126","Z92-N129","Z92-N130","Z95-N134","Z87-N145","Z87-N146","Z102-N157"],"training_dataset_fact_id":"fct_sha256_7ef472fe8ec87d81","uncertainty_method":"GaussianProcessRegressor return_std"}
