{"atlas_bundle_hashes":{"artifacts.json":"6571306fc660bdbeeabe9e51303fab2eeaec5fedb82813c16da45fd322366e89","events.json":"abc7f1f877985481b3d88b96edfb1186ce56964b6e0300a005bc0699f11c3a3f","facts.json":"bff1b5dfbb6298d0e571df1e54855d6ae0d12df94eb093afe715c70c245cc38b","provenance.json":"890f25b1ae520d7984b4a7aae540b8bed4d4c339408af11191d11bf8c6995028"},"atlas_pir_ref":"31d76d094f1206e64a6920da4775d0a684618357","atlas_repository":"https://github.com/Sovrance/Atlas","benchmark_id":"EZ-B001","certificates_file_hash":"d57dbea1719c3514828f51bae7831887166f4e5e09e687fe3b4fc9a79961299a","elementzero_commit":"9b13369ee7a5842b10da1864f83b08bd48228a32","feature_policy_id":"ez-b001-identity-zn-v1","freeze_id":"frz_3d3a4532f61e0906","ground_truth_policy":"ez-gt-policy-v1:evaluated_non_estimated_only","knowledge_freeze_fact_id":"fct_sha256_162698dfd84f706c","legacy_id":"ZME-B001","library_versions":{"elementzero":"0.2.0","numpy":"2.4.4","pir":"0.1.0","scipy":"1.18.0","sklearn":"1.9.0"},"model_fit_fact_id":"fct_sha256_e6ede86bf6d94b22","model_id":"EZ-GP-DIRECT-v1","model_manifest_hash":"3d5176b9033337b86ec4f6ccb59edbda0a92d34958c296422deeb1ec3e3e0188","normalizer_version":"ez-norm-v2","observable":"mi:nuclear_atomic_mass_excess","parser_version":"ame-parser-v2","prediction_fact_ids":["fct_sha256_8b3f311c9535e15f","fct_sha256_246c5ea24b90ee2f","fct_sha256_82610ebd1a78a5fe","fct_sha256_cae53532edaa5a20","fct_sha256_e6926c7b1e69a96c","fct_sha256_0d5b70ec71b6cb5d","fct_sha256_d1fb45263da2a6a3","fct_sha256_f37e81e4e2eeadce","fct_sha256_12a34d0d8a0773e8","fct_sha256_a0b6465c08aa845e","fct_sha256_d4969b5b261c3d78","fct_sha256_54e7ee510de0cf29","fct_sha256_3f1af7a6cad9e209","fct_sha256_19cef0a6c2b8ae37","fct_sha256_a07304ebc77558ec","fct_sha256_d2ddc9be1916b000","fct_sha256_cbca3d0c0ea87682","fct_sha256_ac8163dc243e1003","fct_sha256_73c9672fb23987d2","fct_sha256_4e7e7fbf592e4a0f","fct_sha256_33a7dd2d9a0ccb03","fct_sha256_47c9178790f11928","fct_sha256_8679fda2b67c3d17","fct_sha256_27386b5f43895c28","fct_sha256_9e16d28a2e89e40c","fct_sha256_207f2c7bd87f425e","fct_sha256_0a9efa0d1ddd5b65","fct_sha256_9cace95c4bc47a0f","fct_sha256_945575d9fc503679","fct_sha256_d69d69e9ab9746d0","fct_sha256_63323d81c5fea202","fct_sha256_a4e6a6b491cd8265","fct_sha256_0744b0096ee4a73a","fct_sha256_3ed98d2dc5d0e4ff","fct_sha256_9ac34d88ae218d6a","fct_sha256_5764b5bba2437f22","fct_sha256_f3d1177e317af425","fct_sha256_bb52b7a712ecbe89","fct_sha256_bc7ffcd295953abf","fct_sha256_f899366490cc49e4","fct_sha256_bb86d08bbc8bb06d","fct_sha256_330abababffacce1","fct_sha256_c43f8dd66c6be373","fct_sha256_894489e54977c607","fct_sha256_ae76f3874de39422","fct_sha256_1859b67dcf994971","fct_sha256_d237ca661575ba56","fct_sha256_c28f08c44149f4f3","fct_sha256_0a7864d68bf0db93","fct_sha256_96816995114e8c67","fct_sha256_72af47ce5b2f773d","fct_sha256_9e1fc34cb5e43e94","fct_sha256_f85a2dae528dea09","fct_sha256_a2c0822f99e0f8ca","fct_sha256_2ada382386315ce0","fct_sha256_9cefee9e8aa29383","fct_sha256_43fc94da5e146197","fct_sha256_a0d35822db83996b","fct_sha256_f3b153b88d94dbc2","fct_sha256_9ef448bff0d39c2e","fct_sha256_24dc6dfd0ef0b495","fct_sha256_3a3ab632ed6b6230","fct_sha256_d68473ed621f3ed4","fct_sha256_716277a9222f48d6","fct_sha256_6b7030f7a64e763c","fct_sha256_110f115ab1b2875c","fct_sha256_908e8935fe1c2c04","fct_sha256_ca784be71278a321","fct_sha256_d910b65cd826ae25","fct_sha256_fbc9af3c50ea7075","fct_sha256_e771bfe29dea8486","fct_sha256_af0e86a35ab62555","fct_sha256_82d19f6d53bfc779","fct_sha256_80bd2031e21d4c1a"],"prediction_set_fact_id":"fct_sha256_4f0d0f56be861ca9","predictions_file_hash":"327511be92992c4af989a6c71d9a0b1cce81976f56d287aa1c60d66d87380f20","predictive_distribution":"gaussian","protocol_version":"0.3.0","random_seeds":{"model":0},"run_id":"EZ-GP-DIRECT-v1","source_hashes":["2167f57a2a98331e4649b2dd2b658a9006ed4fba1975729ebfe52a42b4b9218a"],"stage":"predict","target_identity_digest":"9d3e7d5f412d477152e37c15d247dd6f6c35c108c1f1e77e700f87ad4d02d576","target_ids":["Z8-N3","Z5-N15","Z5-N16","Z17-N13","Z24-N20","Z25-N21","Z26-N22","Z27-N23","Z28-N24","Z20-N35","Z20-N36","Z21-N37","Z22-N36","Z21-N38","Z22-N38","Z23-N39","Z23-N40","Z27-N43","Z37-N36","Z29-N48","Z29-N50","Z31-N53","Z31-N54","Z44-N45","Z46-N46","Z46-N47","Z48-N49","Z37-N64","Z49-N52","Z37-N65","Z52-N52","Z54-N54","Z53-N61","Z48-N84","Z56-N94","Z59-N97","Z59-N98","Z60-N98","Z60-N99","Z60-N100","Z61-N99","Z61-N100","Z62-N100","Z62-N101","Z62-N102","Z63-N101","Z64-N100","Z63-N102","Z64-N101","Z65-N100","Z64-N102","Z64-N103","Z65-N102","Z65-N103","Z91-N120","Z91-N129","Z93-N127","Z91-N131","Z93-N129","Z93-N130","Z93-N131","Z93-N133","Z99-N147","Z97-N151","Z101-N148","Z101-N149","Z101-N151","Z103-N150","Z103-N151","Z105-N152","Z105-N153","Z107-N154","Z107-N155","Z109-N157"],"training_dataset_fact_id":"fct_sha256_4b78e0b030d06be0","uncertainty_method":"GaussianProcessRegressor return_std"}
